{
  "$schema": "http://json-schema.org/draft-07/schema#",
  "title": "ReputablePseoCorpus",
  "description": "Schema for the calibration corpus used by scripts/calibration-corpus.ts",
  "type": "object",
  "required": ["version", "sites"],
  "properties": {
    "$schema": { "type": "string" },
    "version": { "type": "string" },
    "ranAt": { "type": ["string", "null"] },
    "rationale": { "type": "string" },
    "verdictRanks": {
      "type": "object",
      "additionalProperties": { "type": "number" }
    },
    "sites": {
      "type": "array",
      "items": { "$ref": "#/definitions/CorpusSite" }
    },
    "excluded": {
      "type": "object",
      "properties": {
        "reason": { "type": "string" },
        "candidates": { "type": "array", "items": { "type": "string" } },
        "futureWork": { "type": "string" }
      }
    }
  },
  "definitions": {
    "CorpusSite": {
      "type": "object",
      "required": ["url", "vertical", "expectedSiteType", "class", "groundTruth"],
      "properties": {
        "url": { "type": "string", "format": "uri" },
        "vertical": { "type": "string" },
        "expectedSiteType": { "type": "string" },
        "class": { "type": "string", "enum": ["reputable", "policy-violating", "subject"] },
        "expectedVerdictCeiling": {
          "type": "string",
          "enum": ["ready", "caution", "concerning", "critical"]
        },
        "expectedVerdictFloor": { "type": "string", "enum": ["ready", "caution", "concerning", "critical"] },
        "gateFloor": {
          "type": "boolean",
          "description": "When true, CI asserts verdict rank >= expectedVerdictFloor. Omitted/false = report/ratchet only. Stamp only on synthetics and addressable policy sites that already meet their floor."
        },
        "visiblePolicies": { "type": "array", "items": { "type": "string" } },
        "detectability": {
          "type": "string",
          "enum": ["on-page", "off-page-only"],
          "description": "Whether the policy violation is visible in fetched page content. 'off-page-only' = site-reputation parasite / host-relationship abuse that an on-page audit cannot detect by construction. Absent = on-page-detectable. Used to compute the engine's addressable calibration ceiling separately from undetectable cases."
        },
        "synthetic": {
          "type": "boolean",
          "description": "true = hand-constructed fixture asserting a recall floor on a specific rule, not a real-world site. Excluded from real-world recall/precision metrics; kept as a separate must-catch floor."
        },
        "groundTruth": {
          "type": "object",
          "required": ["status", "trafficClass", "evidence"],
          "properties": {
            "status": { "type": "string", "enum": ["winning", "stable", "declining", "penalized", "deindexed"] },
            "trafficClass": { "type": "string", "enum": ["very-high", "high", "medium", "low"] },
            "evidence": { "type": "string" },
            "source": { "type": "string", "description": "URL backing the evidence (traffic study, SEO case study, enforcement list)." },
            "asOf": { "type": "string", "description": "ISO date the label was last verified. Labels decay; re-verify periodically." }
          }
        },
        "samplingHint": {
          "type": "object",
          "properties": {
            "sampleSize": { "type": "number" },
            "noRender": { "type": "boolean" }
          }
        },
        "pinnedUrls": {
          "type": "array",
          "items": { "type": "string", "format": "uri" },
          "description": "v0.5.12, pinned page URLs for stable calibration. When non-empty, the calibration runner passes these directly to auditSource as pinnedUrls, bypassing sitemap discovery and random sampling. Populated by --repin mode. Empty array means legacy random sampling."
        },
        "localFixtureDir": {
          "type": "string",
          "description": "v0.5.15, relative path to the fixture directory containing pre-captured HTML for this site (e.g. 'packages/core/calibration/fixtures/wise_com/'). When set and the directory exists, the calibration runner audits from disk instead of making HTTP requests. Populated by --snapshot mode. Absent means live HTTP fetch."
        },
        "classifierUrls": {
          "type": "array",
          "items": { "type": "string" },
          "description": "v0.6.1, full sitemap URL list used for site classification and template detection. Allows fixture-mode calibration (25 pinned audit URLs) to still see the site's true scale and template shape. Populated by --seed-classifier-urls mode. Absent means the classifier uses the audit URL set (the old behaviour)."
        }
      }
    }
  }
}
