{
  "$schema": "./calibration-corpus.schema.json",
  "version": "seed-2",
  "rationale": "STAGING QUEUE \u2014 NOT READ BY THE CALIBRATION RUNNER. Web-sourced (2026-06) policy-violating + matched-reputable candidates to grow the recall corpus toward 30-50 ACROSS ARCHETYPES (not a celeb-farm monoculture) with spam-vs-legit pairs per vertical. Every entry is a DRAFT: before promoting into calibration-corpus.json `sites` it needs (1) live-status re-check (many are dead/pruned -> use a Wayback fixture captured at PENALTY TIME, not the recovered live site), (2) fixture under packages/core/calibration/fixtures/<slug>/ + pinnedUrls, (3) asOf/source confirmed, (4) expectedVerdict* confirmed against a real audit. The `todo` on each lists what's missing. Several reputable counterparts are sourced from marketing listicles \u2014 upgrade to Ahrefs/Sistrix primary before relying. Anonymized enforcement events (no nameable domain) are in `excluded` as leads, NOT fabricated into sites. Promotion workflow: docs/superpowers/calibration/TODO-penalized-corpus.md. NOTE: the June 24-26 2026 spam update (3 days old) hit exactly the location/doorway/faceted archetypes below; named casualties from it are still being sourced and will be appended.",
  "sites": [
    {
      "url": "https://causal.app/",
      "vertical": "saas-finance-seo-heist",
      "archetype": "seo-heist",
      "expectedSiteType": "programmatic-directory",
      "class": "policy-violating",
      "expectedVerdictFloor": "critical",
      "detectability": "on-page",
      "visiblePolicies": [
        "scaled-content-abuse",
        "regurgitated-content"
      ],
      "groundTruth": {
        "status": "deindexed",
        "trafficClass": "very-high",
        "evidence": "Canonical 'SEO heist': ~1,800 articles AI-cloned from competitor Exceljet's sitemap (Byword), peaked ~610k weekly visits Oct 2023, then Ahrefs logged -99.52%; offending posts 301'd to homepage.",
        "source": "https://ahrefs.com/blog/biggest-traffic-losers/",
        "asOf": "2024-12"
      },
      "pinnedUrls": [],
      "confidence": "high",
      "todo": "Wayback fixture of a /blog AI article captured Oct-Nov 2023 pre-redirect; the live site has pruned the AI blog so a live audit won't see the violation"
    },
    {
      "url": "https://www.datanyze.com/companies/",
      "vertical": "b2b-sales-data-directory",
      "archetype": "comparison-directory",
      "expectedSiteType": "programmatic-directory",
      "class": "policy-violating",
      "expectedVerdictFloor": "concerning",
      "detectability": "on-page",
      "visiblePolicies": [
        "scaled-content-abuse",
        "thin-content",
        "templated-no-added-value"
      ],
      "groundTruth": {
        "status": "declining",
        "trafficClass": "very-high",
        "evidence": "Lost ~95-96% of organic traffic in 2024 (~464k monthly pageviews), 80%+ of the loss in the programmatic /companies and /people subfolders (templated company/people stubs); reranked far lower rather than fully deindexed.",
        "source": "https://ahrefs.com/blog/biggest-traffic-losers/",
        "asOf": "2024-08"
      },
      "pinnedUrls": [],
      "confidence": "high",
      "todo": "Wayback fixture of a /companies/ or /people/ stub at penalty time; confirm whether folders were later pruned/noindexed"
    },
    {
      "url": "https://get-invoice.com/",
      "vertical": "saas-fintech-invoicing-ai-farm",
      "archetype": "scaled-content",
      "expectedSiteType": "programmatic-directory",
      "class": "policy-violating",
      "expectedVerdictFloor": "critical",
      "detectability": "on-page",
      "visiblePolicies": [
        "scaled-content-abuse",
        "thin-content"
      ],
      "groundTruth": {
        "status": "deindexed",
        "trafficClass": "low",
        "evidence": "First-party post-mortem: ~22,000 AI-generated pages on a weak domain went from ~130 clicks/day to zero on Feb 28 2025; indexed pages collapsed 20,000+ -> 1 over six months. Recovered only via rebrand to a new domain \u2014 a recent (2025) 'recovery-via-rebrand' edge case.",
        "source": "https://tailride.so/blog/google-penalty-22000-ai-pages",
        "asOf": "2025-02"
      },
      "pinnedUrls": [],
      "confidence": "high",
      "todo": "Confirm get-invoice.com is parked/301'd and deindexed; capture Wayback fixture of the AI pages pre-Feb-2025"
    },
    {
      "url": "https://izoate.com/",
      "vertical": "digital-marketing-blog",
      "archetype": "thin-content",
      "expectedSiteType": "programmatic-directory",
      "class": "policy-violating",
      "expectedVerdictFloor": "concerning",
      "detectability": "on-page",
      "visiblePolicies": [
        "thin-content",
        "eeat-deficiency"
      ],
      "groundTruth": {
        "status": "declining",
        "trafficClass": "medium",
        "evidence": "~89% traffic drop March 2025 core update for low-value/E-E-A-T-deficient content; owner posted the loss in Google Search Central. Recent (2025) entry.",
        "source": "https://support.google.com/webmasters/thread/317789154",
        "asOf": "2025-03"
      },
      "pinnedUrls": [],
      "confidence": "med",
      "todo": "Verify the 89% figure against the owner's GSC thread directly; confirm whether content is programmatic/AI vs merely thin before keeping"
    },
    {
      "url": "https://oldtimemusic.com/",
      "vertical": "music-facts-ai-farm",
      "archetype": "glossary",
      "expectedSiteType": "programmatic-directory",
      "class": "policy-violating",
      "expectedVerdictFloor": "critical",
      "detectability": "on-page",
      "visiblePolicies": [
        "scaled-content-abuse",
        "mass-AI-generation"
      ],
      "groundTruth": {
        "status": "deindexed",
        "trafficClass": "high",
        "evidence": "~2.5M-page templated 'meaning of [song]' AI farm named by SEJ as deindexed in the March 2024 update (later partially reindexed).",
        "source": "https://www.searchenginejournal.com/googles-march-2024-core-update-impact-hundreds-of-websites-deindexed/510981/",
        "asOf": "2024-03"
      },
      "pinnedUrls": [],
      "confidence": "med",
      "todo": "Confirm archetype (song-meaning glossary) + current index state on a Wayback capture"
    },
    {
      "url": "https://historyfact.in/",
      "vertical": "history-gk-ai-farm-india",
      "archetype": "non-english-farm",
      "expectedSiteType": "programmatic-directory",
      "class": "policy-violating",
      "expectedVerdictFloor": "concerning",
      "detectability": "on-page",
      "visiblePolicies": [
        "undisclosed-ai-content",
        "anonymous-operator",
        "low-editorial-oversight"
      ],
      "groundTruth": {
        "status": "declining",
        "trafficClass": "low",
        "evidence": "NewsGuard-named anonymously-operated AI 'unreliable AI news' site (India/.in) with an incompletely-generated About page. NOTE: NewsGuard proves AI-farm status, NOT a Google enforcement action.",
        "source": "https://www.newsguardtech.com/special-reports/newsbots-ai-generated-news-websites-proliferating/",
        "asOf": "2024-01"
      },
      "pinnedUrls": [],
      "confidence": "low",
      "todo": "AI-farm confirmed but Google enforcement UNCONFIRMED \u2014 verify index/visibility status before treating as a penalized label; otherwise demote to a pure thin-content fixture"
    },
    {
      "url": "https://www.latimes.com/coupon-codes",
      "vertical": "parasite-coupons",
      "archetype": "coupon-aggregator",
      "expectedSiteType": "programmatic-directory",
      "class": "policy-violating",
      "expectedVerdictFloor": "concerning",
      "detectability": "off-page-only",
      "visiblePolicies": [
        "site-reputation-abuse"
      ],
      "groundTruth": {
        "status": "deindexed",
        "trafficClass": "high",
        "evidence": "Leased third-party coupon subfolder; ~100% visibility loss in Google's May 5-8 2024 site-reputation-abuse enforcement. TRACKING-ONLY (off-page-only blind spot, undetectable on-page).",
        "source": "https://pressgazette.co.uk/platforms/google-dealt-blow-to-publisher-shopping-revenue-on-eve-of-black-friday-site-reputation-abuse-update/",
        "asOf": "2024-05"
      },
      "pinnedUrls": [],
      "confidence": "high",
      "todo": "off-page-only \u2014 tracked blind-spot example, NOT a recall target; confirm /coupon-codes path live vs pruned"
    },
    {
      "url": "https://www.wsj.com/buyside/",
      "vertical": "parasite-reviews-coupons",
      "archetype": "coupon-aggregator",
      "expectedSiteType": "programmatic-directory",
      "class": "policy-violating",
      "expectedVerdictFloor": "concerning",
      "detectability": "off-page-only",
      "visiblePolicies": [
        "site-reputation-abuse"
      ],
      "groundTruth": {
        "status": "declining",
        "trafficClass": "high",
        "evidence": "WSJ Buy Side caught by the Nov 2024 reinterpreted site-reputation-abuse policy (penalizes regardless of first-party oversight). TRACKING-ONLY (off-page-only blind spot).",
        "source": "https://pressgazette.co.uk/platforms/google-dealt-blow-to-publisher-shopping-revenue-on-eve-of-black-friday-site-reputation-abuse-update/",
        "asOf": "2024-11"
      },
      "pinnedUrls": [],
      "confidence": "med",
      "todo": "off-page-only \u2014 tracked, not a recall target; confirm whether fully deindexed or only declined"
    },
    {
      "url": "https://cointelegraph.com/",
      "vertical": "crypto-news-igaming-section",
      "archetype": "site-section-reputation-abuse",
      "expectedSiteType": "programmatic-directory",
      "class": "policy-violating",
      "expectedVerdictFloor": "concerning",
      "detectability": "off-page-only",
      "visiblePolicies": [
        "site-reputation-abuse",
        "third-party-igaming"
      ],
      "groundTruth": {
        "status": "penalized",